{"$schema":"https://json-schema.org/draft/2020-12/schema","type":"object","additionalProperties":false,"required":["status","exceptionId","sponsor","businessJustification","migrationTarget","expirationDate","manualTriggerOnly","regularPullRequestEnabled","evidenceReference"],"properties":{"status":{"enum":["example","approved","expired","revoked"]},"exceptionId":{"type":"string","pattern":"^EXC-"},"sponsor":{"type":"string"},"businessJustification":{"type":"string"},"migrationTarget":{"type":"string"},"expirationDate":{"type":"string","format":"date"},"manualTriggerOnly":{"const":true},"regularPullRequestEnabled":{"const":false},"evidenceReference":{"type":"string"}}}
